{
  "id": "TOPAPA-001",
  "title": "Tour de passe-passe",
  "type": "special",
  "tier": 4,
  "domains": [],
  "activation": "Passif",
  "range": "—",
  "duration": "—",
  "description": "Au déblocage de cette compétence, choisissez une compétence de n'importe quel arbre coûtant moins de 10 XP et portant l'étiquette {{sort}}. Vous apprenez la compétence choisie."
}
