{
  "id": "DISSEC-001",
  "title": "Dissection",
  "type": "active",
  "tier": 3,
  "domains": [
    "blood"
  ],
  "characteristics": [
    "intelligence"
  ],
  "activation": "10 minutes",
  "range": "Contact",
  "duration": "Instantanée",
  "tags": {
    "practices": [
      "technique"
    ],
    "schools": [
      "creation"
    ]
  },
  "description": "Une carcasse est un magasin pour qui sait où couper. Vous ouvrez proprement le cadavre d'une créature ni humanoïde ni artificielle, vaincue lors d'une rencontre significative. Un cadavre ne se dissèque qu'une fois.\n\nEffectuez un {{jet}} d'{{intelligence}} + {{medecine}} contre un {{dd}} de 15. En cas de réussite, vous recevez une Occasion de butin de plus sur cette source. En cas d'échec, vous abîmez ce que vous cherchiez et n'en tirez rien de plus.",
  "upgrades": [
    {
      "level": 2,
      "tier": 6,
      "title": "Prélèvement propre",
      "description": "Lorsque vous échouez au {{jet}} de {{DISSEC-001}}, vous n'abîmez rien, et vous pouvez rejouer {{DISSEC-001}} une seconde fois sur ce cadavre."
    }
  ]
}
