{
  "id": "CONDRU-001",
  "title": "Connaissances druidiques",
  "type": "passive",
  "tier": 2,
  "domains": [],
  "characteristics": [
    "charisma",
    "intelligence",
    "spirit"
  ],
  "activation": "Passif",
  "range": "—",
  "duration": "—",
  "tags": {
    "practices": [
      "technique"
    ],
    "schools": [
      "enhancement"
    ]
  },
  "description": "Vous avez passé plus de temps dehors que dedans. Lorsque vous effectuez un {{jet}} de {{charisme}}, d'{{intelligence}} ou d'{{esprit}} visant une Plante ou une Bête, vous gagnez 1 {{avantage}} pour ce {{jet}}."
}
