{
  "id": "PETPOI-001",
  "title": "Pétrir la poisse",
  "type": "active",
  "tier": 1,
  "domains": [
    "slime"
  ],
  "characteristics": [
    "intelligence",
    "spirit",
    "charisma"
  ],
  "activation": "1 Action",
  "range": "9 m",
  "duration": "Instantanée ou jusqu'à 10 minutes",
  "energy": 1,
  "tags": {
    "practices": [
      "spell"
    ],
    "schools": [
      "destruction"
    ],
    "specials": [
      "unleashed"
    ]
  },
  "description": "Vous créez, remodelez ou déplacez du mucus de la taille d'une caisse, sous forme fluide, collante ou durcie. Au moment où vous lancez ce {{sort}}, choisissez sa {{caracteristique}} entre {{intelligence}}, {{esprit}} et {{charisme}}.\n\n***Dégâts.*** Utilisé de façon offensive, ce mucus inflige 1d8 dégâts d'Acide. Toute zone plus grande, durée plus longue ou portée accrue que vous lui demandez rend le mucus moins puissant, jusqu'à le rendre inoffensif.\n\n***DD.*** Lorsqu'une créature effectue un {{jet}} pour résister à ce mucus, elle effectue son {{jet}} contre votre {{dd}} (10 + la {{caracteristique}} choisie + {{arcanes}}).\n\n***Forme.*** Ce mucus peut prendre n'importe quelle forme comme une gerbe lancée sur une cible, une flaque qui colle les semelles, un enduit qui rend des marches glissantes, ou même une zone d'effet au choix. Lorsqu'il est réparti en zone, il peut former, au maximum, un cube de 1,5 m d'arête, une sphère de 1,5 m de rayon, un cône de 3 m ou une ligne de 4,5 m sur 1,5 m. Quelle que soit sa forme, ce mucus ne couvre jamais de Poisse ce qu'il atteint.",
  "upgrades": [
    {
      "level": 2,
      "tier": 5,
      "title": "Suintement",
      "description": "Lorsque vous lancez {{PETPOI-001}}, vous pouvez dépenser 1 {{energie}} de plus pour lancer Suintement. Le mucus atteint la taille d'un tonneau, il inflige 2d8 dégâts d'Acide et chaque dimension de sa zone augmente de 1,5 m."
    },
    {
      "level": 3,
      "tier": 10,
      "title": "Coulée",
      "description": "Lorsque vous lancez {{PETPOI-001}}, vous pouvez dépenser 2 {{energie|Énergies}} de plus pour lancer Coulée. Le mucus atteint la taille d'une chambre, il inflige 3d8 dégâts d'Acide et chaque dimension de sa zone augmente de 3 m."
    },
    {
      "level": 4,
      "tier": 10,
      "xpOverride": 75,
      "title": "Vasière",
      "description": "Lorsque vous lancez {{PETPOI-001}}, vous pouvez dépenser 3 {{energie|Énergies}} de plus pour lancer Vasière. Le mucus atteint la taille d'une cabane, il inflige 4d8 dégâts d'Acide et chaque dimension de sa zone augmente de 4,5 m."
    },
    {
      "level": 5,
      "tier": 10,
      "xpOverride": 100,
      "title": "Marécage",
      "description": "Lorsque vous lancez {{PETPOI-001}}, vous pouvez dépenser 4 {{energie|Énergies}} de plus pour lancer Marécage. Le mucus atteint la taille d'une maison, il inflige 5d8 dégâts d'Acide et chaque dimension de sa zone augmente de 6 m."
    }
  ]
}
