{
  "id": "FRENES-001",
  "title": "Frénésie",
  "type": "active",
  "tier": 1,
  "domains": [
    "blood"
  ],
  "activation": "1 Action Bonus",
  "range": "Personnel",
  "duration": "jusqu'à 1 minute",
  "energy": 2,
  "life": "1d6",
  "tags": {
    "practices": [
      "rage"
    ],
    "schools": [
      "enhancement"
    ]
  },
  "description": "Le sang vous monte aux yeux. Tant que {{FRENES-001}} dure, vous êtes {{enrage}}. Si son coût vous fait tomber à 0 {{pdv}}, {{FRENES-001}} n'a aucun effet.\n\nTant que {{FRENES-001}} dure et que vous avez la moitié ou moins de vos {{pdv}} maximum, vous êtes en {{fureur}}.\n\n{{FRENES-001}} prend fin plus tôt si vous cessez d'être {{enrage}}.",
  "upgrades": [
    {
      "level": 2,
      "tier": 4,
      "title": "Premier sang",
      "description": "Pour {{FRENES-001}}, vous êtes en {{fureur}} dès que vous avez les trois quarts ou moins de vos {{pdv}} maximum, au lieu de la moitié."
    },
    {
      "level": 3,
      "tier": 8,
      "title": "Folie furieuse",
      "description": "Tant que {{FRENES-001}} dure, vous êtes en {{fureur}}, quels que soient vos {{pdv}}."
    }
  ]
}
