{
  "id": "POISS-01",
  "status": "draft",
  "title": "Commodo eiusmod",
  "type": "active",
  "tier": 1,
  "domains": [
    "slime"
  ],
  "description": "Lorem ipsum dolor sit amet, consectetur adipiscing elit, sed do eiusmod tempor incididunt ut labore et dolore magna aliqua.\n\nUt enim ad minim veniam, quis nostrud exercitation ullamco laboris nisi ut aliquip ex ea commodo consequat."
}
